{
  "$schema": "https://json-schema.org/draft/2020-12/schema",
  "type": "object",
  "properties": {
    "accountId": {
      "type": "string",
      "minLength": 1
    },
    "endpoint": {
      "type": "string",
      "enum": [
        "quote",
        "historical",
        "orders",
        "other"
      ]
    },
    "rules": {
      "minItems": 1,
      "type": "array",
      "items": {
        "type": "object",
        "properties": {
          "window": {
            "type": "string",
            "enum": [
              "second",
              "minute",
              "day"
            ]
          },
          "brokerLimit": {
            "type": "integer",
            "exclusiveMinimum": 0,
            "maximum": 9007199254740991
          },
          "novaLimit": {
            "type": "integer",
            "exclusiveMinimum": 0,
            "maximum": 9007199254740991
          },
          "used": {
            "type": "integer",
            "minimum": 0,
            "maximum": 9007199254740991
          },
          "resetsAt": {
            "anyOf": [
              {
                "type": "string",
                "format": "date-time",
                "pattern": "^(?:(?:\\d\\d[2468][048]|\\d\\d[13579][26]|\\d\\d0[48]|[02468][048]00|[13579][26]00)-02-29|\\d{4}-(?:(?:0[13578]|1[02])-(?:0[1-9]|[12]\\d|3[01])|(?:0[469]|11)-(?:0[1-9]|[12]\\d|30)|(?:02)-(?:0[1-9]|1\\d|2[0-8])))T(?:(?:[01]\\d|2[0-3]):[0-5]\\d:[0-5]\\d(?:\\.\\d+)?(?:Z))$"
              },
              {
                "type": "null"
              }
            ]
          }
        },
        "required": [
          "window",
          "brokerLimit",
          "novaLimit",
          "used",
          "resetsAt"
        ],
        "additionalProperties": false
      }
    },
    "throttledToday": {
      "type": "integer",
      "minimum": 0,
      "maximum": 9007199254740991
    },
    "updatedAt": {
      "type": "string",
      "format": "date-time",
      "pattern": "^(?:(?:\\d\\d[2468][048]|\\d\\d[13579][26]|\\d\\d0[48]|[02468][048]00|[13579][26]00)-02-29|\\d{4}-(?:(?:0[13578]|1[02])-(?:0[1-9]|[12]\\d|3[01])|(?:0[469]|11)-(?:0[1-9]|[12]\\d|30)|(?:02)-(?:0[1-9]|1\\d|2[0-8])))T(?:(?:[01]\\d|2[0-3]):[0-5]\\d:[0-5]\\d(?:\\.\\d+)?(?:Z))$"
    }
  },
  "required": [
    "accountId",
    "endpoint",
    "rules",
    "throttledToday",
    "updatedAt"
  ],
  "additionalProperties": false
}
