[
  {
    "accountId": "brk_001",
    "endpoint": "quote",
    "rules": [
      {
        "window": "second",
        "brokerLimit": 1,
        "novaLimit": 1,
        "used": 1,
        "resetsAt": null
      }
    ],
    "throttledToday": 0,
    "updatedAt": "2026-09-21T06:25:00Z"
  },
  {
    "accountId": "brk_001",
    "endpoint": "historical",
    "rules": [
      {
        "window": "second",
        "brokerLimit": 3,
        "novaLimit": 2,
        "used": 1,
        "resetsAt": null
      }
    ],
    "throttledToday": 0,
    "updatedAt": "2026-09-21T06:20:00Z"
  },
  {
    "accountId": "brk_001",
    "endpoint": "orders",
    "rules": [
      {
        "window": "second",
        "brokerLimit": 10,
        "novaLimit": 8,
        "used": 3,
        "resetsAt": null
      },
      {
        "window": "minute",
        "brokerLimit": 400,
        "novaLimit": 320,
        "used": 40,
        "resetsAt": null
      },
      {
        "window": "day",
        "brokerLimit": 5000,
        "novaLimit": 4000,
        "used": 120,
        "resetsAt": "2026-09-21T18:30:00Z"
      }
    ],
    "throttledToday": 0,
    "updatedAt": "2026-09-21T06:10:00Z"
  },
  {
    "accountId": "brk_001",
    "endpoint": "other",
    "rules": [
      {
        "window": "second",
        "brokerLimit": 10,
        "novaLimit": 8,
        "used": 1,
        "resetsAt": null
      }
    ],
    "throttledToday": 0,
    "updatedAt": "2026-09-21T06:00:00Z"
  },
  {
    "accountId": "brk_002",
    "endpoint": "quote",
    "rules": [
      {
        "window": "second",
        "brokerLimit": 1,
        "novaLimit": 1,
        "used": 1,
        "resetsAt": null
      }
    ],
    "throttledToday": 2,
    "updatedAt": "2026-09-20T18:00:00Z"
  },
  {
    "accountId": "brk_002",
    "endpoint": "historical",
    "rules": [
      {
        "window": "second",
        "brokerLimit": 3,
        "novaLimit": 2,
        "used": 2,
        "resetsAt": null
      }
    ],
    "throttledToday": 5,
    "updatedAt": "2026-09-20T17:30:00Z"
  },
  {
    "accountId": "brk_002",
    "endpoint": "orders",
    "rules": [
      {
        "window": "second",
        "brokerLimit": 10,
        "novaLimit": 8,
        "used": 5,
        "resetsAt": null
      },
      {
        "window": "minute",
        "brokerLimit": 400,
        "novaLimit": 320,
        "used": 270,
        "resetsAt": null
      },
      {
        "window": "day",
        "brokerLimit": 5000,
        "novaLimit": 4000,
        "used": 3400,
        "resetsAt": "2026-09-21T18:30:00Z"
      }
    ],
    "throttledToday": 0,
    "updatedAt": "2026-09-20T16:00:00Z"
  },
  {
    "accountId": "brk_002",
    "endpoint": "other",
    "rules": [
      {
        "window": "second",
        "brokerLimit": 10,
        "novaLimit": 8,
        "used": 2,
        "resetsAt": null
      }
    ],
    "throttledToday": 0,
    "updatedAt": "2026-09-20T15:00:00Z"
  }
]
